{
  "id": "CPA2019-CH1-S2-31",
  "parent_id": "CPA2019-CH1-S2",
  "path": [
    "CPA2019",
    "CH1",
    "S2",
    "(31)"
  ],
  "order": 31,
  "node_type": "section",
  "content_type": "definition",
  "act_id": "CPA2019",
  "chapter_number": 1,
  "section_number": "2",
  "subsection_number": "(31)",
  "official_text": "\"person\" includes— (i) an individual; (ii) a firm whether registered or not; (iii) a Hindu undivided family; (iv) a co-operative society; (v) an association of persons whether registered under the Societies Registration Act, 1860 or not; (vi) any corporation, company or a body of individuals whether incorporated or not; (vii) any artificial juridical person, not falling within any of the preceding sub-clauses;",
  "citations": [
    {
      "act": "Consumer Protection Act, 2019",
      "chapter": "I",
      "section": "2",
      "subsection": "(31)"
    }
  ],
  "relationships": [],
  "document": {
    "page": 6,
    "paragraph": 2
  },
  "metadata": {
    "jurisdiction": "India",
    "language": "en",
    "status": "active",
    "effective_from": "2019-07-20",
    "effective_to": null,
    "checksum": "d3c22d86b6a858e187d26a0b204315a1110d655b48db60ea9beefe3a9b4b6e34",
    "token_count": 62
  }
}