{
  "id": "CPA2019-CH1-S2-5",
  "parent_id": "CPA2019-CH1-S2",
  "path": [
    "CPA2019",
    "CH1",
    "S2",
    "(5)"
  ],
  "order": 5,
  "node_type": "section",
  "content_type": "definition",
  "act_id": "CPA2019",
  "chapter_number": 1,
  "section_number": "2",
  "subsection_number": "(5)",
  "official_text": "\"complainant\" means— (i) a consumer; or (ii) any voluntary consumer association registered under any law for the time being in force; or (iii) the Central Government or any State Government; or (iv) the Central Authority; or (v) one or more consumers, where there are numerous consumers having the same interest; or (vi) in case of death of a consumer, his legal heir or legal representative; or (vii) in case of a consumer being a minor, his parent or legal guardian;",
  "citations": [
    {
      "act": "Consumer Protection Act, 2019",
      "chapter": "I",
      "section": "2",
      "subsection": "(5)"
    }
  ],
  "relationships": [],
  "document": {
    "page": 2,
    "paragraph": 5
  },
  "metadata": {
    "jurisdiction": "India",
    "language": "en",
    "status": "active",
    "effective_from": "2019-07-20",
    "effective_to": null,
    "checksum": "b724e9a9aca03e4e70aae1fc2a83036bb021d0ba16b33a295e6199e8db78d201",
    "token_count": 80
  }
}