{
  "id": "CPA2019-CH1-S2-44",
  "parent_id": "CPA2019-CH1-S2",
  "path": [
    "CPA2019",
    "CH1",
    "S2",
    "(44)"
  ],
  "order": 44,
  "node_type": "section",
  "content_type": "definition",
  "term": "State Commission",
  "act_id": "CPA2019",
  "chapter_number": 1,
  "section_number": "2",
  "subsection_number": "(44)",
  "official_text": "\"State Commission\" means a State Consumer Disputes Redressal Commission established under sub-section (1) of section 42;",
  "citations": [
    {
      "act": "Consumer Protection Act, 2019",
      "chapter": "I",
      "section": "2",
      "subsection": "(44)"
    }
  ],
  "relationships": [
    {
      "target": "CPA2019-CH4-S42-1",
      "relation": "refers_to",
      "context": "established under sub-section (1) of section 42"
    }
  ],
  "document": {
    "page": 7,
    "paragraph": 7
  },
  "metadata": {
    "jurisdiction": "India",
    "language": "en",
    "status": "active",
    "effective_from": "2019-07-20",
    "effective_to": null,
    "checksum": "8dd1fefcd5250d15b8f068fe541b2ab98aabc8e3421dd27326cae3c13a130512",
    "token_count": 16
  }
}