{
  "id": "CPA2019-CH5-S74-4",
  "parent_id": "CPA2019-CH5-S74",
  "path": [
    "CPA2019",
    "CH5",
    "S74",
    "(4)"
  ],
  "order": 4,
  "node_type": "section",
  "content_type": "obligation",
  "act_id": "CPA2019",
  "chapter_number": 5,
  "section_number": "74",
  "subsection_number": "(4)",
  "official_text": "Every consumer mediation cell shall maintain— (a) a list of empanelled mediators; (b) a list of cases handled by the cell; (c) record of proceeding; and (d) any other information as may be specified by regulations.",
  "citations": [
    {
      "act": "Consumer Protection Act, 2019",
      "chapter": "V",
      "section": "74",
      "subsection": "(4)"
    }
  ],
  "relationships": [],
  "document": {
    "page": 30,
    "paragraph": 2
  },
  "metadata": {
    "jurisdiction": "India",
    "language": "en",
    "status": "active",
    "effective_from": "2019-07-20",
    "effective_to": null,
    "checksum": "feb185b309ac171ad8c61133bad3eb5886ca1137e1de6f092e2bffe4b002635d",
    "token_count": 36
  }
}