{
  "id": "CPA2019-CH4-S66",
  "parent_id": "CPA2019-CH4",
  "path": [
    "CPA2019",
    "CH4",
    "S66"
  ],
  "order": 1,
  "node_type": "section",
  "content_type": "procedure",
  "act_id": "CPA2019",
  "chapter_number": 4,
  "section_number": "66",
  "subsection_number": "",
  "official_text": "Where the National Commission or the State Commission, as the case may be, on an application by a complainant or otherwise, is of the opinion that it involves the larger interest of consumers, it may direct any individual or organisation or expert to assist the National Commission or the State Commission, as the case may be.",
  "citations": [
    {
      "act": "Consumer Protection Act, 2019",
      "chapter": "IV",
      "section": "66",
      "subsection": ""
    }
  ],
  "relationships": [],
  "document": {
    "page": 24,
    "paragraph": 5
  },
  "metadata": {
    "jurisdiction": "India",
    "language": "en",
    "status": "active",
    "effective_from": "2019-07-20",
    "effective_to": null,
    "checksum": "919b9c6babf917cb5ce154382511bfc405d610424cfc7dfa15eeb6fcc0d2ecf5",
    "token_count": 56
  }
}